{
  "id": "brand-launch-ig-day1",
  "createdAt": "2024-01-01T00:00:00.000Z",
  "postId": "meet-the-brand-instagram",
  "recordedAt": "2026-04-08",
  "impressions": 2450,
  "reach": 1820,
  "likes": 187,
  "comments": 24,
  "shares": 15,
  "saves": 42,
  "clicks": 38,
  "engagementRate": 4.8,
  "followerChange": 28,
  "notes": "Carousel performed well. Slide 3 had highest dwell time."
}
